{
  "$schema": "../../schemas/pattern.schema.json",
  "id": "search-results",
  "title": "Search Results",
  "intent": [
    "Allow users to find content quickly with clear query + filters.",
    "Differentiate empty vs no-results vs error states.",
    "Support keyboard-first workflows."
  ],
  "uses_contracts": ["search-input", "filter-bar", "tabs", "list", "list-item", "pagination", "empty-state", "skeleton", "toast", "link"],
  "structure": [
    "Header: search input + optional tabs for result types.",
    "Filters: use filter bar; show active chips and reset option.",
    "Results: list or table; include result count; pagination or infinite scroll (choose one).",
    "No-results: suggest clearing filters or changing query; provide reset action."
  ],
  "a11y": {
    "keyboard": [
      "Search input focus on page load only when user intent is search-focused (avoid stealing focus in general apps).",
      "Results are reachable via Tab; active state is not color-only."
    ],
    "aria": [
      "Results region is labeled; empty state includes headings and actions."
    ]
  },
  "validation": {
    "rules": [
      "Avoid jitter: debounce query updates or require explicit submit for server searches.",
      "No-results state must not appear while loading."
    ],
    "error_messaging": [
      "If search fails: \"Couldn’t load results. Try again.\""
    ]
  },
  "token_usage": [],
  "examples": [
    {
      "title": "No results message",
      "html": "<section aria-label=\"No results\"><h2>No results</h2><button type=\"button\">Reset filters</button></section>"
    }
  ]
}

