{
  "$schema": "../../schemas/pattern.schema.json",
  "id": "crud-import",
  "title": "CRUD: Import",
  "intent": [
    "Import data from a file with clear validation and preview.",
    "Make failures actionable and allow retries.",
    "Show progress for long imports."
  ],
  "uses_contracts": ["file-upload", "table", "progress", "alert", "button", "toast", "empty-state"],
  "structure": [
    "Step 1: upload file (accept formats + size limits).",
    "Step 2: validate + show preview table with issues highlighted.",
    "Step 3: import with progress; show success summary and error report."
  ],
  "a11y": {
    "keyboard": [
      "Upload and actions operable by keyboard.",
      "Preview table uses semantic table."
    ],
    "aria": [
      "Progress uses progressbar semantics; errors use status/alert roles appropriately."
    ]
  },
  "validation": {
    "rules": [
      "Validation errors must reference row/column context.",
      "Import must be cancelable if it takes long (optional)."
    ],
    "error_messaging": [
      "Explain what failed and how to fix the file; provide downloadable error report (optional)."
    ]
  },
  "token_usage": [],
  "examples": [
    {
      "title": "Import steps",
      "html": "<ol><li>Upload</li><li>Review</li><li>Import</li></ol>"
    }
  ]
}

