{
  "$schema": "../../schemas/pattern.schema.json",
  "id": "async-section",
  "title": "Async Section (Loading → Error → Empty → Data)",
  "intent": [
    "Provide a consistent pattern for any async-loaded region.",
    "Avoid layout jank and confusing state transitions.",
    "Make errors recoverable and accessible."
  ],
  "uses_contracts": ["skeleton", "empty-state", "alert", "toast", "button", "link"],
  "structure": [
    "Default state order: loading (skeleton) → data OR empty OR error.",
    "Loading uses skeleton placeholders with stable height/structure.",
    "Error state offers retry; show technical details only in logs.",
    "Empty state is specific (no-results vs first-run vs error)."
  ],
  "a11y": {
    "keyboard": [
      "Retry button is reachable via Tab and activates with Enter/Space.",
      "Do not steal focus on loading; only move focus when presenting a full replacement fallback."
    ],
    "aria": [
      "Use aria-busy=\"true\" on the section container while loading.",
      "Error messages use role=\"status\" or role=\"alert\" depending on urgency."
    ]
  },
  "validation": {
    "rules": [
      "Do not show empty state while loading (avoid flicker).",
      "Retry must be safe (avoid double mutations) or show a clear warning.",
      "Never rely on color alone to communicate error/success."
    ],
    "error_messaging": [
      "Use short, actionable copy: what happened + what to do next.",
      "Provide a retry and, if relevant, a fallback navigation link."
    ]
  },
  "token_usage": [
    {
      "token": "semantic.color.bg.surface",
      "maps_to": "Section container",
      "notes": "Use surface for card-like async sections; canvas for full-page."
    }
  ],
  "examples": [
    {
      "title": "Section wrapper with aria-busy",
      "html": "<section aria-busy=\"true\" aria-label=\"Results\">…</section>"
    }
  ]
}

